Cluster,Income,SpendingScore,Mô tả
0,63282.55985915493,77.33626760563381,Thu nhập trung bình chi tiêu cao: Có thể quảng bá gói giá trị tốt hoặc upsell.
1,79158.79166666667,40.291666666666664,"Thu nhập cao, chi tiêu trung bình: Khuyến nghị nâng cấp sản phẩm."
2,37291.71946795647,28.01571946795647,Thu nhập và chi tiêu đều thấp. Nên áp dụng khuyến mãi lớn.
3,58863.82590529248,25.424791086350975,Thu nhập trung bình chi tiêu thấp: Cần gợi ý sản phẩm thiết yếu.
4,41410.84167636787,76.89871944121072,"Thu nhập thấp, chi tiêu cao. Gợi ý sản phẩm giá phù hợp."
